{
  "schema_version": "1.0",
  "key": "replicates",
  "file_kind": "tsv",
  "description": "Replicate TSV: first column maps expression column identifiers to biological or technical replicate labels.",
  "example": "column\treplicate\tbatch\nsample_1\tr1\tbatch_a\nsample_2\tr2\tbatch_a\nsample_3\tr1\tbatch_b",
  "delimiter": "\t",
  "header": true,
  "min_rows": 1,
  "min_columns": 2,
  "first_column_role": "expression_column_id",
  "required_columns": [
    "replicate"
  ],
  "unique_first_column": true,
  "data_columns_type": "any",
  "data_numeric_min_fraction": 0.0,
  "column_types": {
    "replicate": "string",
    "batch": "string",
    "condition": "string"
  },
  "cross_checks": [
    {
      "kind": "first_column_subset_expression_columns"
    },
    {
      "kind": "row_count_matches_expression_columns"
    }
  ]
}
