{
  "schema_version": "1.0",
  "key": "chromatin_accessibility_matrix",
  "file_kind": "tsv",
  "description": "Paired chromatin accessibility matrix TSV: first column contains peak or genomic-region identifiers and remaining columns contain per-cell accessibility values. Data column headers must match expression matrix cell identifiers for paired scRNA-seq plus scATAC-seq methods.",
  "example": "region\tcell_1\tcell_2\nchr1:100-250\t0\t3\nchr1:400-520\t1\t0",
  "delimiter": "\t",
  "header": true,
  "min_rows": 1,
  "min_columns": 2,
  "first_column_role": "none",
  "unique_first_column": true,
  "data_columns_type": "float",
  "data_numeric_min_fraction": 1.0,
  "required_columns": [],
  "column_types": {},
  "cross_checks": [
    {
      "kind": "data_columns_subset_expression_columns"
    }
  ]
}
