{
  "schema_version": "1.0",
  "key": "perturbation_design",
  "file_kind": "tsv",
  "description": "Perturbation design TSV: first column maps expression column identifiers to experimental condition metadata for perturbational datasets.",
  "example": "column\tcondition\tperturbation\ttarget\tdose\ttimepoint\treplicate\ncell_1\tcontrol\tnone\t\t0\t0\tr1\ncell_2\tknockdown_G1\tknockdown\tG1\t1\t24\tr1",
  "delimiter": "\t",
  "header": true,
  "min_rows": 1,
  "min_columns": 2,
  "first_column_role": "expression_column_id",
  "required_columns": [
    "condition"
  ],
  "unique_first_column": true,
  "data_columns_type": "any",
  "data_numeric_min_fraction": 0.0,
  "column_types": {
    "condition": "string",
    "perturbation": "string",
    "target": "string",
    "dose": "float",
    "timepoint": "float",
    "replicate": "string",
    "control": "bool"
  },
  "cross_checks": [
    {
      "kind": "first_column_subset_expression_columns"
    },
    {
      "kind": "row_count_matches_expression_columns"
    },
    {
      "kind": "column_subset_expression_genes",
      "column": "target"
    }
  ]
}
