{
  "schema_version": "1.0",
  "key": "interventions",
  "file_kind": "tsv",
  "description": "Intervention TSV: one row per intervention definition, including the perturbed target gene and intervention effect.",
  "example": "intervention\ttarget\teffect\tsign\tdose\nknockdown_G1\tG1\tknockdown\t-1\t1.0\noverexpress_G2\tG2\toverexpression\t1\t1.0",
  "delimiter": "\t",
  "header": true,
  "min_rows": 1,
  "min_columns": 3,
  "first_column_role": "none",
  "required_columns": [
    "intervention",
    "target",
    "effect"
  ],
  "unique_first_column": true,
  "column_types": {
    "intervention": "string",
    "target": "string",
    "effect": "string",
    "sign": "int",
    "dose": "float",
    "timepoint": "float"
  },
  "cross_checks": [
    {
      "kind": "column_subset_expression_genes",
      "column": "target"
    }
  ]
}
