{
  "schema_version": "1.0",
  "key": "lineage_tree",
  "file_kind": "tsv",
  "description": "Lineage tree TSV with child, parent, gain_rate and loss_rate. Every group must appear as a child; root groups use parent '__root__' with gain_rate=0 and loss_rate=0.",
  "example": "child\tparent\tgain_rate\tloss_rate\nC1\t__root__\t0\t0\nC2\tC1\t0.2\t0.1",
  "delimiter": "\t",
  "header": true,
  "min_rows": 1,
  "required_columns": ["child", "parent", "gain_rate", "loss_rate"],
  "column_types": {
    "child": "string",
    "parent": "string",
    "gain_rate": "float",
    "loss_rate": "float"
  },
  "cross_checks": []
}
