{
  "schema_version": "1.0",
  "key": "spatial_coordinates",
  "file_kind": "tsv",
  "description": "Spatial coordinate TSV: first column maps expression cell identifiers to numeric spatial coordinates used by spatial transcriptomics methods.",
  "example": "cell\tx\ty\ncell_1\t0.0\t1.2\ncell_2\t0.5\t1.4",
  "delimiter": "\t",
  "header": true,
  "min_rows": 1,
  "min_columns": 3,
  "first_column_role": "expression_column_id",
  "required_columns": [
    "x",
    "y"
  ],
  "unique_first_column": true,
  "data_columns_type": "float",
  "data_numeric_min_fraction": 1.0,
  "column_types": {
    "x": "float",
    "y": "float",
    "z": "float"
  },
  "cross_checks": [
    {
      "kind": "first_column_subset_expression_columns"
    },
    {
      "kind": "row_count_matches_expression_columns"
    }
  ]
}
