{
  "schema_version": "1.0",
  "key": "prior_grn",
  "file_kind": "tsv",
  "description": "Global prior GRN edges with source regulator, target gene and score. Nonzero scores indicate known or putative regulatory connections; sign and magnitude may be meaningful to tools that estimate regulator activity from priors.",
  "example": "source\ttarget\tscore\nTF1\tG1\t1\nTF2\tG2\t-1",
  "delimiter": "\t",
  "header": true,
  "min_rows": 1,
  "required_columns": ["source", "target", "score"],
  "column_types": {
    "source": "string",
    "target": "string",
    "score": "float"
  },
  "cross_checks": [
    {"kind": "column_subset_expression_genes", "column": "source"},
    {"kind": "column_subset_expression_genes", "column": "target"}
  ]
}
