{
  "schema_version": "1.0",
  "key": "cluster_markers",
  "file_kind": "tsv",
  "description": "Cluster marker TSV: Seurat FindAllMarkers-style marker table with one row per upregulated marker gene and a cluster assignment for that marker.",
  "example": "geneID\tp_val\tavg_logFC\tpct.1\tpct.2\tp_val_adj\tcluster\tgene\nG1\t0.001\t0.8\t0.7\t0.2\t0.01\tA\tG1\nG2\t0.002\t0.6\t0.6\t0.1\t0.02\tB\tG2",
  "delimiter": "\t",
  "header": true,
  "min_rows": 1,
  "min_columns": 4,
  "first_column_role": "none",
  "required_columns": [
    "cluster",
    "gene",
    "p_val_adj"
  ],
  "column_types": {
    "cluster": "string",
    "gene": "string",
    "p_val_adj": "float",
    "avg_logFC": "float"
  },
  "cross_checks": [
    {
      "kind": "column_subset_expression_genes",
      "column": "gene"
    },
    {
      "kind": "column_subset_extra_column",
      "column": "cluster",
      "other_input": "groups",
      "other_column": "cluster"
    }
  ]
}
