{
  "schema_version": "1.0",
  "key": "grnboost_network",
  "file_kind": "tsv",
  "description": "Precomputed GRNBoost2 network TSV: directed regulator-target edges with raw GRNBoost2 importance scores, used by tools that can skip de novo GRNBoost2 inference.",
  "example": "source\ttarget\tscore\nTF1\tG1\t0.82\nTF2\tG2\t0.41",
  "delimiter": "\t",
  "header": true,
  "min_rows": 1,
  "min_columns": 3,
  "first_column_role": "none",
  "required_columns": [
    "source",
    "target",
    "score"
  ],
  "column_types": {
    "source": "string",
    "target": "string",
    "score": "float"
  },
  "cross_checks": [
    {
      "kind": "column_subset_expression_genes",
      "column": "source"
    },
    {
      "kind": "column_subset_expression_genes",
      "column": "target"
    }
  ]
}
